min_timestamp,tag_grouping,opportunity_uuid,message,direction,application_date_c,bgc_conversion_7d,full_conversion,task_row_count,total_task_count,bucket_production
2025-05-05 17:15:42.000000 UTC,UpF,34a59100-6f0b-4112-9bb3-a3ca1e0079d4,I will but busy for now,Inbound,2025-04-25,True,,12,16,OBJ-BS-001
2025-03-26 16:33:03.000000 UTC,UpF,34d61ba5-6b6d-45fb-aba5-afde6ecbc55d,"Kk. Thanks, you as well",Inbound,2025-03-23,True,True,2,19,UNCLASSIFIED
2025-03-26 16:33:03.000000 UTC,UpF,34d61ba5-6b6d-45fb-aba5-afde6ecbc55d,Probably Friday,Inbound,2025-03-23,True,True,3,19,OBJ-DL-001
2025-03-26 16:33:03.000000 UTC,UpF,34d61ba5-6b6d-45fb-aba5-afde6ecbc55d,Didn't get any hits for 30 minutes so turned it off and will try again another day,Inbound,2025-03-23,True,True,5,19,OBJ-DL-001
2025-03-26 16:33:03.000000 UTC,UpF,34d61ba5-6b6d-45fb-aba5-afde6ecbc55d,I completed first order last night. Went good other than the gps pin for customers house is inaccurate. Fortunately she sent me a message in the app telling me her actual coordinates and it was delivered successfully,Inbound,2025-03-23,True,True,8,19,OBJ-TX-001
2025-03-26 16:33:03.000000 UTC,UpF,34d61ba5-6b6d-45fb-aba5-afde6ecbc55d,Completed my first door dash. Not sure where to find my crimson account,Inbound,2025-03-23,True,True,10,19,OBJ-NO-003
2025-03-26 16:33:03.000000 UTC,UpF,34d61ba5-6b6d-45fb-aba5-afde6ecbc55d,Ok great! Thanks. You as well,Inbound,2025-03-23,True,True,11,19,UNCLASSIFIED
2025-03-26 16:33:03.000000 UTC,UpF,34d61ba5-6b6d-45fb-aba5-afde6ecbc55d,Tomorrow evening I can,Inbound,2025-03-23,True,True,16,19,UNCLASSIFIED
2025-03-26 16:33:03.000000 UTC,UpF,34d61ba5-6b6d-45fb-aba5-afde6ecbc55d,It wouldn't let me do anything until my identity is verified,Inbound,2025-03-23,True,True,19,19,OBJ-DL-001
2025-01-15 17:31:16.000000 UTC,UpF,355e0900-73ea-49ad-9a24-d51ee5fcd18b,Aún no tengo transporte,Inbound,2025-01-12,True,False,2,3,UNCLASSIFIED
2025-05-01 16:33:08.000000 UTC,UpF,35605fd0-b10a-4739-a1ed-1ad75f740381,Android,Inbound,2025-04-22,True,False,1,14,OBJ-DL-001
2025-05-01 16:33:08.000000 UTC,UpF,35605fd0-b10a-4739-a1ed-1ad75f740381,This is all that comes up. There is no button to push to take selfie. It's just a white page,Inbound,2025-04-22,True,False,2,14,UNCLASSIFIED
2025-05-01 16:33:08.000000 UTC,UpF,35605fd0-b10a-4739-a1ed-1ad75f740381,"Nope, still doing the same thing",Inbound,2025-04-22,True,False,3,14,OBJ-SC-001
2025-05-01 16:33:08.000000 UTC,UpF,35605fd0-b10a-4739-a1ed-1ad75f740381,"Ok, thank you",Inbound,2025-04-22,True,False,4,14,UNCLASSIFIED
2025-05-01 16:33:08.000000 UTC,UpF,35605fd0-b10a-4739-a1ed-1ad75f740381,I called customer service and they told me to fill out a form. Will this prevent me from becoming a dasher?,Inbound,2025-04-22,True,False,7,14,OBJ-NO-003
2025-05-01 16:33:08.000000 UTC,UpF,35605fd0-b10a-4739-a1ed-1ad75f740381,I have tried several times. Deleted the app and everything. Still no change,Inbound,2025-04-22,True,False,8,14,OBJ-BS-001
2025-05-01 16:33:08.000000 UTC,UpF,35605fd0-b10a-4739-a1ed-1ad75f740381,"Yes, there is something wrong with the app. It will not let me take a selfie to finish identifying me.",Inbound,2025-04-22,True,False,13,14,OBJ-DL-001
2025-03-13 16:27:13.000000 UTC,UpF,35d75ba6-0c66-4004-a439-ba4468b5e78f,I don't have a lisense,Inbound,2025-03-10,True,,3,3,UNCLASSIFIED
2025-04-01 16:36:21.000000 UTC,UpF,35f9d09c-a69a-40a2-8d11-0e6d25674350,Working right now. I'll try later.,Inbound,2025-03-29,,,2,5,OBJ-GJ-001
2025-04-01 16:36:21.000000 UTC,UpF,35f9d09c-a69a-40a2-8d11-0e6d25674350,Take me off,Inbound,2025-03-29,,,4,5,UNCLASSIFIED
2025-01-29 17:31:29.000000 UTC,UpF,35fed2e2-ad48-4c8e-a733-0f0f1598077e,Wat do I do to start,Inbound,2025-01-26,,,2,3,UNCLASSIFIED
2025-04-01 16:36:37.000000 UTC,UpF,36045d07-472e-4157-ab06-59ba7b75dcec,"No, even with Wi-Fi off it wont allow me to continue",Inbound,2025-03-28,True,,3,25,UNCLASSIFIED
2025-04-01 16:36:37.000000 UTC,UpF,36045d07-472e-4157-ab06-59ba7b75dcec,The app goes blank Everytime I scan my face,Inbound,2025-03-28,True,,4,25,OBJ-BS-001
2025-04-01 16:36:37.000000 UTC,UpF,36045d07-472e-4157-ab06-59ba7b75dcec,Yes,Inbound,2025-03-28,True,,5,25,UNCLASSIFIED
2025-04-01 16:36:37.000000 UTC,UpF,36045d07-472e-4157-ab06-59ba7b75dcec,iPhone,Inbound,2025-03-28,True,,8,25,UNCLASSIFIED
2025-04-01 16:36:37.000000 UTC,UpF,36045d07-472e-4157-ab06-59ba7b75dcec,Wont let me move forward,Inbound,2025-03-28,True,,11,25,UNCLASSIFIED
2025-04-01 16:36:37.000000 UTC,UpF,36045d07-472e-4157-ab06-59ba7b75dcec,e,Inbound,2025-03-28,True,,12,25,UNCLASSIFIED
2025-04-01 16:36:37.000000 UTC,UpF,36045d07-472e-4157-ab06-59ba7b75dcec,It's now not letting me submit my bank info,Inbound,2025-03-28,True,,13,25,TSI-BI-001
2025-04-01 16:36:37.000000 UTC,UpF,36045d07-472e-4157-ab06-59ba7b75dcec,Ok,Inbound,2025-03-28,True,,14,25,UNCLASSIFIED
2025-04-01 16:36:37.000000 UTC,UpF,36045d07-472e-4157-ab06-59ba7b75dcec,It wont allow me to dash near me,Inbound,2025-03-28,True,,15,25,OBJ-NO-003
2025-04-01 16:36:37.000000 UTC,UpF,36045d07-472e-4157-ab06-59ba7b75dcec,I'm not sure,Inbound,2025-03-28,True,,16,25,UNCLASSIFIED
2025-04-01 16:36:37.000000 UTC,UpF,36045d07-472e-4157-ab06-59ba7b75dcec,"It finally worked, thank you",Inbound,2025-03-28,True,,21,25,OBJ-GJ-001
2025-03-25 16:35:54.000000 UTC,UpF,3676feed-81ee-4f28-b342-1fb15425f2a4,No I'm ready,Inbound,2025-03-19,,,4,4,UNCLASSIFIED
2025-01-13 17:22:33.000000 UTC,UpF,36a5594a-7711-4cbc-baa1-7ec7500659da,It can't read my license,Inbound,2025-01-08,,,3,4,OBJ-DL-001
2025-01-21 17:38:53.000000 UTC,UpF,36c14404-5f99-434c-a178-86b267f004a1,Stop,Inbound,2025-01-15,,,3,3,UNCLASSIFIED
2025-01-15 17:27:15.000000 UTC,UpF,36eb4b70-9896-43f6-b0b6-ad5a5acb8423,I gotta get a New id first,Inbound,2025-01-12,,,2,6,OBJ-DL-001
2025-02-10 17:34:46.000000 UTC,UpF,36ef8ac3-d51c-4d73-aa64-6280991128b2,"Hi 
As i am new to dorash how can i get deliveries",Inbound,2025-02-07,True,True,2,4,UNCLASSIFIED
2025-02-10 17:34:46.000000 UTC,UpF,36ef8ac3-d51c-4d73-aa64-6280991128b2,I clicked on dash now but there is no delivery here,Inbound,2025-02-07,True,True,3,4,OBJ-NO-003
2025-03-25 16:35:54.000000 UTC,UpF,37064aa9-c363-40c1-b8dd-3eb7a339fcb8,Nope,Inbound,2025-03-20,,,5,6,UNCLASSIFIED
2025-03-25 16:35:54.000000 UTC,UpF,37064aa9-c363-40c1-b8dd-3eb7a339fcb8,Fuck uuuuuu,Inbound,2025-03-20,,,6,6,UNCLASSIFIED
2025-01-23 17:24:24.000000 UTC,UpF,384d4941-ad0d-4729-9b69-d00326628d22,Hi! I'm stuck on this screen after submitting my license and photo. I haven't been able to get past this page,Inbound,2025-01-16,,,1,5,OBJ-DL-001
2025-02-03 17:42:37.000000 UTC,UpF,3889be35-f7dc-4278-9b08-1383e6277b57,No I'm ready,Inbound,2025-01-31,True,,6,6,UNCLASSIFIED
2025-03-17 16:41:59.000000 UTC,UpF,38be043f-8f26-4b07-90bb-b54133cd4d4d,"Hello, it is still asking for my ID.",Inbound,2025-03-12,True,,2,9,OBJ-DL-001
2025-03-17 16:41:59.000000 UTC,UpF,38be043f-8f26-4b07-90bb-b54133cd4d4d,Yes. The fact that I've tried submitting my ID multiple times and nothing happens.,Inbound,2025-03-12,True,,5,9,OBJ-BS-001
2025-01-14 17:21:29.000000 UTC,UpF,38ed2bce-baac-450a-acd6-88a72456c990,"Oh okay sick, thanks",Inbound,2025-01-09,True,False,1,15,OBJ-SC-001
2025-01-14 17:21:29.000000 UTC,UpF,38ed2bce-baac-450a-acd6-88a72456c990,My identity is being verified,Inbound,2025-01-09,True,False,3,15,OBJ-DL-001
2025-01-14 17:21:29.000000 UTC,UpF,38ed2bce-baac-450a-acd6-88a72456c990,Or just in the first week?,Inbound,2025-01-09,True,False,4,15,OBJ-TX-001
2025-01-14 17:21:29.000000 UTC,UpF,38ed2bce-baac-450a-acd6-88a72456c990,"Yep, I got everything completed, so now I'm ready to start dashing",Inbound,2025-01-09,True,False,5,15,OBJ-NO-003
2025-01-14 17:21:29.000000 UTC,UpF,38ed2bce-baac-450a-acd6-88a72456c990,Do I get the free bag if my first delivery is within a week of signing up? Or just anytime?,Inbound,2025-01-09,True,False,8,15,OBJ-NO-003
2025-01-14 17:21:29.000000 UTC,UpF,38ed2bce-baac-450a-acd6-88a72456c990,Is it anytime?,Inbound,2025-01-09,True,False,10,15,OBJ-BS-001
2025-01-14 17:21:29.000000 UTC,UpF,38ed2bce-baac-450a-acd6-88a72456c990,"Yep, it worked!",Inbound,2025-01-09,True,False,13,15,OBJ-GJ-001
2025-01-14 17:21:29.000000 UTC,UpF,38ed2bce-baac-450a-acd6-88a72456c990,"I do not, unfortunately, but I will likely start in the next 5 days",Inbound,2025-01-09,True,False,15,15,OBJ-SC-001
2025-03-17 16:35:17.000000 UTC,UpF,391c6335-dd2b-474e-ae66-399766dd5aae,"That's what I'm wondering, had my identity been verified yet",Inbound,2025-03-14,True,,2,9,OBJ-DL-001
2025-05-12 16:44:54.000000 UTC,UpF,3963b27e-cbe0-45ce-8337-438c76549f11,No,Inbound,2025-05-01,,,2,8,UNCLASSIFIED
2025-05-12 16:44:54.000000 UTC,UpF,3963b27e-cbe0-45ce-8337-438c76549f11,I want to earn extra cash,Inbound,2025-05-01,,,4,8,UNCLASSIFIED
2025-05-12 16:44:54.000000 UTC,UpF,3963b27e-cbe0-45ce-8337-438c76549f11,Yes,Inbound,2025-05-01,,,5,8,UNCLASSIFIED
2025-05-12 16:44:54.000000 UTC,UpF,3963b27e-cbe0-45ce-8337-438c76549f11,What application,Inbound,2025-05-01,,,7,8,UNCLASSIFIED
2025-02-06 17:58:21.000000 UTC,UpF,3a1cfd88-8f7d-4200-aeb3-14f37c535be7,Hello I need to change my information of my car,Inbound,2025-02-03,,,2,3,OBJ-CP-001
2025-01-21 17:38:53.000000 UTC,UpF,3a1d09eb-6b61-40ac-a42c-f9c0a97e9818,No,Inbound,2025-01-15,,,4,6,UNCLASSIFIED
2025-01-21 17:38:53.000000 UTC,UpF,3a1d09eb-6b61-40ac-a42c-f9c0a97e9818,Android,Inbound,2025-01-15,,,5,6,OBJ-DL-001
2025-01-21 17:38:53.000000 UTC,UpF,3a1d09eb-6b61-40ac-a42c-f9c0a97e9818,I can't get the application to load,Inbound,2025-01-15,,,6,6,UNCLASSIFIED
2025-05-29 16:31:14.000000 UTC,UpF,3b159c41-0c51-4273-b3bc-31460de7ed9b,If you open a review what does that do?,Inbound,2025-05-20,True,,2,21,UNCLASSIFIED
2025-05-29 16:31:14.000000 UTC,UpF,3b159c41-0c51-4273-b3bc-31460de7ed9b,,Inbound,2025-05-20,True,,3,21,UNCLASSIFIED
2025-05-29 16:31:14.000000 UTC,UpF,3b159c41-0c51-4273-b3bc-31460de7ed9b,I did still doing this,Inbound,2025-05-20,True,,4,21,OBJ-DL-001
2025-05-29 16:31:14.000000 UTC,UpF,3b159c41-0c51-4273-b3bc-31460de7ed9b,No I haven't yet I was going to try in a little bit.,Inbound,2025-05-20,True,,6,21,UNCLASSIFIED
2025-05-29 16:31:14.000000 UTC,UpF,3b159c41-0c51-4273-b3bc-31460de7ed9b,Yes,Inbound,2025-05-20,True,,8,21,UNCLASSIFIED
2025-05-29 16:31:14.000000 UTC,UpF,3b159c41-0c51-4273-b3bc-31460de7ed9b,Same thing try again later I guess,Inbound,2025-05-20,True,,10,21,UNCLASSIFIED
2025-05-29 16:31:14.000000 UTC,UpF,3b159c41-0c51-4273-b3bc-31460de7ed9b,Im on a android,Inbound,2025-05-20,True,,11,21,OBJ-DL-001
2025-05-29 16:31:14.000000 UTC,UpF,3b159c41-0c51-4273-b3bc-31460de7ed9b,Wouldn't let me go to the next step said to center yourself in the camera and nothing was happening,Inbound,2025-05-20,True,,12,21,OBJ-DL-001
2025-05-29 16:31:14.000000 UTC,UpF,3b159c41-0c51-4273-b3bc-31460de7ed9b,I just tried and it got to where it asked me for my address to send a gift if I do a delivery in 7 days then it said error,Inbound,2025-05-20,True,,19,21,OBJ-NO-003
2025-02-12 17:35:37.000000 UTC,UpF,3b385007-5b8d-4bff-8572-6be585855df4,For some reason the app blacked out on my phone so I guess I need to uninstall and reinstall,Inbound,2025-02-08,,,4,6,UNCLASSIFIED
2025-01-17 17:27:50.000000 UTC,UpF,3bb968bf-e08f-443c-847c-25a1af324c30,No,Inbound,2025-01-14,,,1,19,UNCLASSIFIED
2025-01-17 17:27:50.000000 UTC,UpF,3bb968bf-e08f-443c-847c-25a1af324c30,Yes,Inbound,2025-01-14,,,6,19,UNCLASSIFIED
2025-01-17 17:27:50.000000 UTC,UpF,3bb968bf-e08f-443c-847c-25a1af324c30,Yes,Inbound,2025-01-14,,,7,19,UNCLASSIFIED
2025-01-17 17:27:50.000000 UTC,UpF,3bb968bf-e08f-443c-847c-25a1af324c30,The system won't accept my license for some reason,Inbound,2025-01-14,,,12,19,OBJ-DL-001
2025-01-17 17:27:50.000000 UTC,UpF,3bb968bf-e08f-443c-847c-25a1af324c30,WiFi,Inbound,2025-01-14,,,14,19,UNCLASSIFIED
2025-01-17 17:27:50.000000 UTC,UpF,3bb968bf-e08f-443c-847c-25a1af324c30,No I'm stuck at id scan,Inbound,2025-01-14,,,17,19,OBJ-DL-001
2025-01-17 17:27:50.000000 UTC,UpF,3bb968bf-e08f-443c-847c-25a1af324c30,Could you help me finish signing up?,Inbound,2025-01-14,,,18,19,UNCLASSIFIED
2025-02-06 18:02:49.000000 UTC,UpF,3bbfe0db-88a0-493e-ba80-7a7f7945a0d5,Thank you,Inbound,2025-02-03,True,,2,10,UNCLASSIFIED
2025-02-06 18:02:49.000000 UTC,UpF,3bbfe0db-88a0-493e-ba80-7a7f7945a0d5,Thank you,Inbound,2025-02-03,True,,3,10,UNCLASSIFIED
2025-02-06 18:02:49.000000 UTC,UpF,3bbfe0db-88a0-493e-ba80-7a7f7945a0d5,"I apologize, I never got around to delivering, I have been busy for the past few days. I'll start delivering tomorrow.",Inbound,2025-02-03,True,,8,10,OBJ-NO-003
2025-03-25 16:34:15.000000 UTC,UpF,3cab0ee4-14c4-4de5-991a-a168fdefcdcf,STOP,Inbound,2025-03-19,,,2,3,UNCLASSIFIED
2025-03-25 16:34:15.000000 UTC,UpF,3dcceca8-3157-4ad4-9720-5461e9394a5b,I can finish the application,Inbound,2025-03-20,True,,5,8,UNCLASSIFIED
2025-03-25 16:34:15.000000 UTC,UpF,3dcceca8-3157-4ad4-9720-5461e9394a5b,No,Inbound,2025-03-20,True,,7,8,UNCLASSIFIED
2025-03-25 16:34:15.000000 UTC,UpF,3dcceca8-3157-4ad4-9720-5461e9394a5b,I did it already,Inbound,2025-03-20,True,,8,8,OBJ-DL-001
2025-01-16 20:25:58.000000 UTC,UpF,3ee32199-5d8a-48d1-a2cb-d853e33ab8f1,No it's a white page that won't load after I uploaded my id,Inbound,2025-01-13,,,1,9,OBJ-DL-001
2025-01-16 20:25:58.000000 UTC,UpF,3ee32199-5d8a-48d1-a2cb-d853e33ab8f1,Yes sorry,Inbound,2025-01-13,,,2,9,UNCLASSIFIED
2025-01-16 20:25:58.000000 UTC,UpF,3ee32199-5d8a-48d1-a2cb-d853e33ab8f1,Do you mind sending the link to complete,Inbound,2025-01-13,,,6,9,UNCLASSIFIED
2025-01-16 20:25:58.000000 UTC,UpF,3ee32199-5d8a-48d1-a2cb-d853e33ab8f1,I went back in and finished uploading my information,Inbound,2025-01-13,,,9,9,TSI-CB-001
2025-05-30 16:24:40.000000 UTC,UpF,3ef623be-c987-4fc7-bbee-c1984cef17e8,Okay,Inbound,2025-05-27,,,1,6,UNCLASSIFIED
2025-05-30 16:24:40.000000 UTC,UpF,3ef623be-c987-4fc7-bbee-c1984cef17e8,STFU,Inbound,2025-05-27,,,6,6,UNCLASSIFIED
2025-03-26 16:28:41.000000 UTC,UpF,3efcf7d2-6002-4b6c-be82-8c55d881fa69,Okay,Inbound,2025-03-22,,,1,7,UNCLASSIFIED
2025-03-26 16:28:41.000000 UTC,UpF,3efcf7d2-6002-4b6c-be82-8c55d881fa69,My paper ID has a picture on it,Inbound,2025-03-22,,,4,7,OBJ-DL-001
2025-03-26 16:28:41.000000 UTC,UpF,3efcf7d2-6002-4b6c-be82-8c55d881fa69,I only have a paper ID,Inbound,2025-03-22,,,6,7,OBJ-DL-001
2025-01-22 18:46:08.000000 UTC,UpF,3eff28c0-fb7e-499c-a0bc-31f6b5262f76,"If I have social security but I don't have a license, only an ID, does the person need social security to start working at this company?",Inbound,2025-01-17,,,3,6,OBJ-GJ-001
2025-01-22 18:46:08.000000 UTC,UpF,3eff28c0-fb7e-499c-a0bc-31f6b5262f76,"Hi, what do I have to do? The other person told me to go to the indii app if it is",Inbound,2025-01-17,,,5,6,UNCLASSIFIED
2025-01-22 18:46:08.000000 UTC,UpF,3eff28c0-fb7e-499c-a0bc-31f6b5262f76,"Yes, I understand English but I don't speak it perfectly. I just translate the messages now.",Inbound,2025-01-17,,,6,6,UNCLASSIFIED
2025-04-15 16:39:46.000000 UTC,UpF,3f70115b-7a4d-46fe-8d46-c81b01460c64,I just haven't gotten time to finish filling it out I'm sorry,Inbound,2025-04-12,True,,1,8,OBJ-BS-001
2025-04-15 16:39:46.000000 UTC,UpF,3f70115b-7a4d-46fe-8d46-c81b01460c64,I did,Inbound,2025-04-12,True,,7,8,OBJ-DL-001
2025-01-30 17:22:24.000000 UTC,UpF,3f9bef54-5450-4049-8f7e-0db160082f6f,Thank you for the help,Inbound,2025-01-15,True,,2,10,UNCLASSIFIED
2025-01-30 17:22:24.000000 UTC,UpF,3f9bef54-5450-4049-8f7e-0db160082f6f,Hey Alex,Inbound,2025-01-15,True,,3,10,UNCLASSIFIED
2025-01-30 17:22:24.000000 UTC,UpF,3f9bef54-5450-4049-8f7e-0db160082f6f,I think I have submitted a background check,Inbound,2025-01-15,True,,4,10,TSI-BC-001
2025-01-30 17:22:24.000000 UTC,UpF,3f9bef54-5450-4049-8f7e-0db160082f6f,I can do that myself,Inbound,2025-01-15,True,,6,10,UNCLASSIFIED
2025-01-30 17:22:24.000000 UTC,UpF,3f9bef54-5450-4049-8f7e-0db160082f6f,No,Inbound,2025-01-15,True,,9,10,UNCLASSIFIED
2025-01-31 17:26:53.000000 UTC,UpF,3fbd7f0f-c35f-44d9-86ef-12a193c41043,Yes! 👍,Inbound,2025-01-28,,,1,6,UNCLASSIFIED
2025-01-31 17:26:53.000000 UTC,UpF,3fbd7f0f-c35f-44d9-86ef-12a193c41043,Okay!,Inbound,2025-01-28,,,4,6,UNCLASSIFIED
2025-04-14 16:43:00.000000 UTC,UpF,40b800fb-8a49-4439-812e-e336f59d29b8,Do y'all have a option for foot delivery,Inbound,2025-04-09,,,4,6,OBJ-NO-003
2025-03-04 17:39:21.000000 UTC,UpF,41419389-c010-4ace-bc45-0b4c019907b2,Dentener,Inbound,2025-03-01,,,1,3,UNCLASSIFIED
2025-02-13 19:17:20.000000 UTC,UpF,4172d802-f0ff-4d5b-865e-a8b7acc9a4ae,eat shit,Inbound,2025-02-06,,,1,3,UNCLASSIFIED
2025-03-26 16:37:09.000000 UTC,UpF,4220485b-d9ee-4a7f-aa20-97dd9e2eb1b1,I dont have a drivers liscense i have a ebike,Inbound,2025-03-21,,,1,5,OBJ-BK-001
2025-03-26 16:37:09.000000 UTC,UpF,4220485b-d9ee-4a7f-aa20-97dd9e2eb1b1,No id,Inbound,2025-03-21,,,4,5,OBJ-DL-001
2025-04-03 16:36:27.000000 UTC,UpF,426be6c2-9e17-4ac2-a299-293d1c9feaea,I want to do the dordash,Inbound,2025-03-30,True,,2,3,OBJ-NO-003
2025-05-27 16:22:03.000000 UTC,UpF,426fa6da-70f4-4425-9871-b131d1766f29,I am reporting you,Inbound,2025-05-23,,,1,8,UNCLASSIFIED
2025-05-27 16:22:03.000000 UTC,UpF,426fa6da-70f4-4425-9871-b131d1766f29,STOP,Inbound,2025-05-23,,,2,8,UNCLASSIFIED
2025-05-27 16:22:03.000000 UTC,UpF,426fa6da-70f4-4425-9871-b131d1766f29,Stop,Inbound,2025-05-23,,,3,8,UNCLASSIFIED
2025-05-27 16:22:03.000000 UTC,UpF,426fa6da-70f4-4425-9871-b131d1766f29,Sending me orders,Inbound,2025-05-23,,,4,8,TSI-NO-001
2025-05-27 16:22:03.000000 UTC,UpF,426fa6da-70f4-4425-9871-b131d1766f29,Start,Inbound,2025-05-23,,,6,8,UNCLASSIFIED
2025-05-27 16:22:03.000000 UTC,UpF,426fa6da-70f4-4425-9871-b131d1766f29,I am reporting your business to the police,Inbound,2025-05-23,,,7,8,UNCLASSIFIED
2025-05-27 16:22:03.000000 UTC,UpF,426fa6da-70f4-4425-9871-b131d1766f29,START,Inbound,2025-05-23,,,8,8,UNCLASSIFIED
2025-02-03 17:38:29.000000 UTC,UpF,430ae898-ddd0-405b-ba45-d153651787be,And how do I know you're really from door dash,Inbound,2025-01-30,,,2,11,OBJ-NO-003
2025-02-03 17:38:29.000000 UTC,UpF,430ae898-ddd0-405b-ba45-d153651787be,I did complete it?!,Inbound,2025-01-30,,,4,11,OBJ-DL-001
2025-02-03 17:38:29.000000 UTC,UpF,430ae898-ddd0-405b-ba45-d153651787be,"Liked ""Oh I see, it looks like you had started a dasher a...""",Inbound,2025-01-30,,,8,11,OBJ-NO-003
2025-02-03 17:38:29.000000 UTC,UpF,430ae898-ddd0-405b-ba45-d153651787be,That isn't my email address though. At least not the one I'm registered with DoorDash for,Inbound,2025-01-30,,,9,11,OBJ-NO-003
2025-02-03 17:38:29.000000 UTC,UpF,430ae898-ddd0-405b-ba45-d153651787be,Nope,Inbound,2025-01-30,,,10,11,UNCLASSIFIED
2025-02-03 17:42:37.000000 UTC,UpF,43a41ed9-bcce-48cb-8faf-cbc0b62db1c0,I finished it,Inbound,2025-01-31,True,True,2,4,UNCLASSIFIED
2025-02-24 17:29:31.000000 UTC,UpF,45332a38-cccc-4280-8b6e-cb757f3be59b,Yes. I failed the identity verification because my face scan was blurry and it stopped me. I emailed support and they said they fixed it so I could retry but it is not letting me. Please advise I would like to start. Thanks,Inbound,2025-02-15,,,3,3,OBJ-DL-001
2025-04-21 16:26:25.000000 UTC,UpF,454497d4-d811-4c19-bb37-e67a28c0cc5e,"I think it's my cloud storage or something, but it won't let me download the app as soon as I can I'll be ready",Inbound,2025-04-17,True,False,4,6,UNCLASSIFIED
2025-04-21 16:26:25.000000 UTC,UpF,454497d4-d811-4c19-bb37-e67a28c0cc5e,Does the app cost to download?,Inbound,2025-04-17,True,False,5,6,UNCLASSIFIED
2025-02-10 17:28:33.000000 UTC,UpF,45a67b67-07dc-47c6-b4ab-bb1f0b02f67d,What's happening to it right now,Inbound,2025-02-07,True,,2,10,UNCLASSIFIED
2025-02-10 17:28:33.000000 UTC,UpF,45a67b67-07dc-47c6-b4ab-bb1f0b02f67d,Okay thank you it's processing now,Inbound,2025-02-07,True,,4,10,UNCLASSIFIED
2025-02-10 17:28:33.000000 UTC,UpF,45a67b67-07dc-47c6-b4ab-bb1f0b02f67d,How long does the background check take,Inbound,2025-02-07,True,,6,10,TSI-BC-001
2025-02-10 17:28:33.000000 UTC,UpF,45a67b67-07dc-47c6-b4ab-bb1f0b02f67d,No,Inbound,2025-02-07,True,,7,10,UNCLASSIFIED
2025-02-10 17:28:33.000000 UTC,UpF,45a67b67-07dc-47c6-b4ab-bb1f0b02f67d,I can't it says We're currently verifying your identity. Our team will update you via email in the next 24 to 48 hours. Once verified you'll be able to continue with your application.,Inbound,2025-02-07,True,,10,10,OBJ-DL-001
2025-02-03 17:38:29.000000 UTC,UpF,463caba6-2a87-4f8d-bcb4-c3825e397337,Just about done with application.  Would like to start as soon as possible,Inbound,2025-01-31,True,,3,3,UNCLASSIFIED
2025-04-21 16:32:26.000000 UTC,UpF,473e5bb8-1374-442d-b632-f6aa8d7dcb4a,Thank you so much I appreciate it. He plays about 80 baseball games from June until October so we are busy all week and the weekends so on days that we are free during the day that's when we plan on dashing. And he will be helping me because I'm going to use it as his job but I'm going to be the one working he will just earn the money.,Inbound,2025-04-17,True,True,1,17,OBJ-NO-003
2025-04-21 16:32:26.000000 UTC,UpF,473e5bb8-1374-442d-b632-f6aa8d7dcb4a,How long does it take to get the email verifying my identity?  I did the photo of my ID and a face scan.,Inbound,2025-04-17,True,True,7,17,OBJ-DL-001
2025-04-21 16:32:26.000000 UTC,UpF,473e5bb8-1374-442d-b632-f6aa8d7dcb4a,My son is 17 so he's going to be helping me.  I'm old lol.,Inbound,2025-04-17,True,True,9,17,UNCLASSIFIED
2025-04-21 16:32:26.000000 UTC,UpF,473e5bb8-1374-442d-b632-f6aa8d7dcb4a,I have a pickup at a 7-Eleven that is liquor. And it's not giving me the directions it's not working like it normally does all it says is return to task but it just takes me to a black screen with the red check mark in the center. What how do I handle liquor because it's not giving me directions,Inbound,2025-04-17,True,True,11,17,OBJ-GJ-001
2025-04-21 16:32:26.000000 UTC,UpF,473e5bb8-1374-442d-b632-f6aa8d7dcb4a,I'm still interested in door dash but it will be sporadic as best until summer and my son is out of school.  So end of May.,Inbound,2025-04-17,True,True,12,17,OBJ-NO-003
2025-04-21 16:32:26.000000 UTC,UpF,473e5bb8-1374-442d-b632-f6aa8d7dcb4a,I got it straightened out and figured out the ID scan.,Inbound,2025-04-17,True,True,13,17,OBJ-DL-001
2025-04-21 16:32:26.000000 UTC,UpF,473e5bb8-1374-442d-b632-f6aa8d7dcb4a,He's going to be my Runner running and get food or whatever the case is or dropping it off. It helps him get past some of his social anxiety as well,Inbound,2025-04-17,True,True,14,17,UNCLASSIFIED
2025-04-21 16:32:26.000000 UTC,UpF,473e5bb8-1374-442d-b632-f6aa8d7dcb4a,We've done like 5 or 6.  It was a bit confusing at first but we got the hang of it now.,Inbound,2025-04-17,True,True,16,17,OBJ-TX-001
2025-04-21 16:32:26.000000 UTC,UpF,473e5bb8-1374-442d-b632-f6aa8d7dcb4a,We are getting ready to dash for the first time. We are headed to the Arnold area,Inbound,2025-04-17,True,True,17,17,OBJ-NO-003
2025-04-11 16:38:48.000000 UTC,UpF,48900236-dce2-4df4-9faa-72663cc18759,"I have my state ID, and no I haven't recently tried",Inbound,2025-04-06,,,3,15,OBJ-DL-001
2025-04-11 16:38:48.000000 UTC,UpF,48900236-dce2-4df4-9faa-72663cc18759,"It's off-topic; I'm not sure if you can answer or not, but you should follow me on Instagram, and we can be mutuals.",Inbound,2025-04-06,,,6,15,UNCLASSIFIED
2025-04-11 16:38:48.000000 UTC,UpF,48900236-dce2-4df4-9faa-72663cc18759,"Désolé si cette question vous met mal à l'aise, mon cœur.",Inbound,2025-04-06,,,7,15,UNCLASSIFIED
2025-04-11 16:38:48.000000 UTC,UpF,48900236-dce2-4df4-9faa-72663cc18759,"My driver license, but it's currently on paper bc the real id hasn't been delivered yet",Inbound,2025-04-06,,,8,15,OBJ-CP-001
2025-04-11 16:38:48.000000 UTC,UpF,48900236-dce2-4df4-9faa-72663cc18759,How are you,Inbound,2025-04-06,,,10,15,UNCLASSIFIED
2025-04-11 16:38:48.000000 UTC,UpF,48900236-dce2-4df4-9faa-72663cc18759,Hey Alex,Inbound,2025-04-06,,,12,15,UNCLASSIFIED
2025-04-11 16:38:48.000000 UTC,UpF,48900236-dce2-4df4-9faa-72663cc18759,Okay thank you!,Inbound,2025-04-06,,,13,15,UNCLASSIFIED
2025-04-11 16:38:48.000000 UTC,UpF,48900236-dce2-4df4-9faa-72663cc18759,I have one more question,Inbound,2025-04-06,,,14,15,UNCLASSIFIED
2025-01-17 17:26:00.000000 UTC,UpF,499e9dc7-942d-463a-b9d1-271a1565844b,"No, I just need to submit my drivers liscense",Inbound,2025-01-14,,,2,4,OBJ-CP-001
2025-03-14 16:28:39.000000 UTC,UpF,4c99e434-b300-469e-aa41-aef48e665b2c,Stop,Inbound,2025-03-11,,,1,3,UNCLASSIFIED
2025-03-14 16:28:39.000000 UTC,UpF,4c99e434-b300-469e-aa41-aef48e665b2c,"I won't be doing it any longer, thank you",Inbound,2025-03-11,,,3,3,UNCLASSIFIED
2025-03-24 22:56:48.000000 UTC,UpF,4dc92f81-bc7e-4e10-9141-e2618ddc8942,It states that my identity is still being verified- it's also said that for a few days now,Inbound,2025-03-19,True,,1,6,OBJ-DL-001
2025-01-30 17:22:24.000000 UTC,UpF,4e5f9693-ae37-4646-922a-5bf40f8ce0fe,Ok,Inbound,2025-01-15,,,1,7,UNCLASSIFIED
2025-01-30 17:22:24.000000 UTC,UpF,4e5f9693-ae37-4646-922a-5bf40f8ce0fe,I did tht,Inbound,2025-01-15,,,3,7,OBJ-DL-001
2025-01-30 17:22:24.000000 UTC,UpF,4e5f9693-ae37-4646-922a-5bf40f8ce0fe,No kirkwoodrayray534@gmail.com,Inbound,2025-01-15,,,4,7,UNCLASSIFIED
2025-01-30 17:22:24.000000 UTC,UpF,4e5f9693-ae37-4646-922a-5bf40f8ce0fe,My background check,Inbound,2025-01-15,,,5,7,TSI-BC-001
2025-02-05 17:27:09.000000 UTC,UpF,4e6db2c4-3d37-420d-a559-2528f6f0166b,Wouldn't you go through,Inbound,2025-02-02,,,1,9,UNCLASSIFIED
2025-02-05 17:27:09.000000 UTC,UpF,4e6db2c4-3d37-420d-a559-2528f6f0166b,Ok,Inbound,2025-02-02,,,4,9,UNCLASSIFIED
2025-02-05 17:27:09.000000 UTC,UpF,4e6db2c4-3d37-420d-a559-2528f6f0166b,Yes,Inbound,2025-02-02,,,8,9,UNCLASSIFIED
2025-02-05 17:27:09.000000 UTC,UpF,4e6db2c4-3d37-420d-a559-2528f6f0166b,"I can't do that, Alex because I don't have the proper papers for you.I have a Driver's license.I have a car but that's it",Inbound,2025-02-02,,,9,9,OBJ-CP-001
2025-01-21 17:38:53.000000 UTC,UpF,4eeae78e-4056-4d2c-a00c-953cc66bdd66,"I'm Driving

- Sent from My Car",Inbound,2025-01-16,,,2,7,OBJ-CP-001
